{
  "bundle_id": "jira_C3APM_20260309_1144",
  "created_at": "2026-03-09",
  "source": "jira",
  "files": {
    "request": "product_request.md",
    "tickets": "tickets.json",
    "customer_notes": "customer_notes.md",
    "metrics_snapshot": "metrics_snapshot.json",
    "competitors": "competitors.md"
  }
}