{
    "bundle_id": "sample_01",
    "created_at": "2026-03-02",
    "source": "local",
    "files": {
      "request": "product_request.md",
      "tickets": "tickets.json",
      "customer_notes": "customer_notes.md",
      "metrics_snapshot": "metrics_snapshot.json",
      "competitors": "competitors.md"
    },
    "docs_dir": "docs"
  }